Participant ID,Assumption ID,Summary
41 ,A12,The login credentials returned by DF23 are not encrypted
41 ,A13,The PDS docs storage contains only correctly generated documents
41 ,A14,"The data stores keep no logs, so no log-threats are considered"
41 ,A14,The delivery scheduler communicates only internally and is thus considered secure
41 ,A6,"A PDS user (E4) can try to login to the PDS (DF6) an unlimited number of times, with no delay even a large amount of attempt"
41 ,A7,There is no requirement set on the strength of the password when a PDS user (E4) registers (DF8)
41 ,A8,"The deovery entities (E1,E2,E3) and the PDS user (E4) will never deny that they received a certain document when they actually did"
41 ,A9,The data flows DF4+DF5 are not encrypted and thus do not have channel confidentiality
43 ,A10,"Data stores don't have any security (pwd, session)"
43 ,A10,"Data stores don't have any security (pwd, session)"
43 ,A11,Following data flows are not encrypted: DF3-DF4
43 ,A6,"The delivery manager sends documents + link based on info found in metadata (Address,Delivery method,..)"
43 ,A7,Passwords are stored encrypted
43 ,A8,"When a PDS user registers, extra checks will be performed before creating the account. No extra checks when adding to PDS user data"
43 ,A8,"When a PDS user registers, extra checks will be performed before creating the account. No extra checks when adding to PDS user data"
43 ,A9,Documents in PDS docs can't be edited
45 ,A10,The PDS user has no reason to deny that he or she consulted their PDS
45 ,A11,the edocs manager is authenticated by means of credentials
45 ,A6,Edocs should incorporate CAPTCHA for registration of the PDS or a timeout
45 ,A7a,eDocs must state at registration that their users of the PDS choose a safe pwd (e.g. not easily guessable)
45 ,A7b,PDS user is authenticated by means of credentials
45 ,A9,The URL provided by email takes the user to his PDS (DF7). Extra authentication is required
46 ,A6,"The user accesses the PDS by authentication, ie having credentials"
46 ,A7,The log of the user is stored in the data store
47 ,A6,The PDS user is authenticated by means of credentials
47 ,A7,"The likelihood of E1,E2 or E3 denying that they have received the documents is low"
47 ,A9,The likelihood of the encryption keys for the flows DF1-DF3 being stolen from the external services is low
48 ,A10,The data stores are considered free from tampering or disclosure because they are used only by processes from within the trust boundary
48 ,A11,The information in DF5 isnt of much value so the likeliness of disclosion (sic) is low
48 ,A12,The delivery scheduler (P2) is free from threats; it's only used by the components within the trust boundary 
48 ,A13,The PDS process(P3) checks whether the user request if valid (e.g. can not request files from other users) against tampering and disclosure
48 ,A14,The likelihood of tampering with DF5 is low because it has low impact (nothing can be gained by the attack)
48 ,A6,"T and ID threats are not applicalbe for DF1-3,6-10 because these data flows are encrypted"
48 ,A7,Tampering with the document sent via mail (DF4) is difficult because the documents are encrypted with the private key of the sender
48 ,A8,"The external print and zoomit service handle their credentials for authenticating with eDocs with care, so that it's very hard to obtain these"
48 ,"A9
", Data flows from within the trust boundary are considered free from tampering or disclosure
49 ,A6,It is possible to impersonate processes and hijack data flows with a MITM attack
49 ,A7,It is possible to impersonate processes and hijack data flows with a MITM attack
50 ,A10,"Tampering for P1,P2,P3,DS1,DS2,DS3 does not apply because they cannot be directly accessed from the outside and A1 states they shall not be attacked from the inside"
50 ,A11,A PDS user cannot use repudiation because the PDSDB keeps track of which documents have been opened
50 ,A12,Repudiation on any logs in DS1 or DS2 is not interesting to an attacker; we assume them to be idempotent
50 ,A13,ID not possible for P1 and P2 without insider access
50 ,A7,"Because P1,P2, P3 are in the trust boundary, we assyme they can be correctly identified and not spoofed"
50 ,A8,PDS user is authenticated by means of credentials
50 ,A9,The PDS user db contains no logs and is therefore not a repudiation target
51 ,A10,"No physicall access to the system by a non-employee is possible. Thus communication using data flows is entirely inside of the system are secure because employees are to be trusted (A1). As a result, these data flows are considered to have confidentiality and integrity"
51 ,A11,The system will contact a delivery service in case a delivery status hasnt been received for a while
51 ,A12,"Because the delivery manager only communicates with other internal processes, and thus spoofing is not possible (based also on A1 and A3)"
51 ,A13,"All data stores do not have direct data flows with external entities, thus tampering and information disclosure are not possible (also based on A1 and A3)"
51 ,A6,The eDocs system can safely start communication with an external delivery service (ie it cant commit to a spoofed entity)
51 ,A7,A PDS user has nothing to gain from denying having read or downloaded a document from the PDS
51 ,A8,"Delivery status only consists of the actual status (e.g. ""delivered"", ""read""...) and not of additional user address information"
51 ,A9,"It is very unlikely for internal processes (P1,P2,P3) to deny sending or receiving certain information. Therefore repudiation of these processes does not apply"
52 ,A10,The delivery scheduler (P1) is implemented well (protected well on code and memory level). Therefore we dont consider tampering and information disclosure aim to it.
52 ,A11,The delivery manager and PDS (P2 and P3) are implemented securely
52 ,A12,The PDS (DS2) and PDS user data (DS3) contains correctly generated documents and reliable information of user
52 ,A13,The PDS docs and PDS user data are implemented correctly
52 ,A14,"The data flow internal of the eDocs system (DF11-DF23) are all happening within local area network, so we dont consider them to be tampered"
52 ,A15,"Since data flow (DF11-DF20) all contains very similar assets (documents,ids, statuses) and it's apparently easier to observe data flow between PDS and a data store (DF19,DF20). So I assume DF19 and DF20 are easier to be attacked. Therefore DF11-DF18 has low priority for ID threats"
52 ,A17,"Data flow between PDS and User data store (DFS21-DS23) should have higher priority than DF19 and DF20, because user data is much easier to make use. And since the attacker gets user data,it's easier for the attacker to login to PDS and get specific documents of these users."
52 ,A19,"The fata flow internal of the edocs system are not encrypted, so they are easy to suffer information disclosure threat"
52 ,A20,"The PDS users are not always trained about information secrecy knowledge,so they are not aware of the risks of carelessly storing their credentials. Therefore they are easy to be spoofed"
52 ,A20,"The PDS users are always not be trained about information security knowledge, so they are not aware of the risks of carelessly storing their credentials. Therefore they are easy to be spoofed"
52 ,A6,"The external service provider E1,E2,E3 are trustworthy"
52 ,A7,"Since the generated docs archive and the delivery scheduler, the delivery manager also perform delivering based on reliable information"
52 ,A8,The employees of the edocs system are trained about information security knowledge so that not easy to be spoofed
52 ,A9,The external service providers are trained about information security so that they are not easily spoofed
53 ,A10,"All memory devices are cleaned if they need to be replaced  (failed hard drive), DS1-3"
53 ,A6,"The addresses of the following entities (E1,E2,E3) are known and static and cannot be spoofed and authenticate using keys"
53 ,A7,"P3, the PDS does not disclose any information except to authorized and authenticated users (and to P2. delivery manager)"
53 ,A8,DS2 (PDS docs) and DS3 (PDS user data) are configured to only answer to requests originating from PDS
53 ,A9,"DS1 (Generated docs archive) is configured to only respond to requests coming from P1,P2"
54 ,A6,"After negotiations for SLA, E1 and E3 are deemed trustworthy"
54 ,A7,Credentials are not saved in plaintext
54 ,A7,The eDocs system does not require to log in to zoomit in order to send it documents (nothing is said in domain analysis)
54 ,A8,We assume eDocs is a trustworthy company which does not want to harm its clients and business partners
55 ,A10,"Since A2, tampering with DF1-DF3 and DF6-DF10 is impossible"
55 ,A11,Since A1 and A3: tampering and ID of the data stores is impossible
55 ,A12,A print service uses a website to communicate with its clients (eDocs system)
55 ,A13,Since A2 entails channel integrity ID from data flow is not considered for those data flows
55 ,A6,"In this day and age, the amount of recipients that asks to have their invoices and/or payslips delivered by post is small"
55 ,A7,There is no authentication of zoomit or mail provider
55 ,A8,The PDS user has access to all its personal information in case its address ... needs to be changed or updated
55 ,A9,"Since A1, the data stores are not protected"
56 ,A6,The PDS user is authenticated by means of credentials
56 ,A7,eDocs does not store any data about batches of document it has sent to zoomit/print service
57 ,A10,No logs used in the system
57 ,A11,No inputs validation is used in the system (P3)
57 ,A7,Zoomit and mail provider dont have to authenticate before sending delivery status updates
57 ,A8,The zoomit service and email provider dont have to be authenticated to update the delivery status
57 ,A9,The PDS user is authenticated by means of credentials
58 ,A10,The PDS user is authenticated by means of PDS credentials
58 ,A6,The sent documents via Zoomit(E2) or mail provider (E3) are stored in a cache in case of a failure (no docs are lost) (DF1-DF3) 
58 ,A7,"The PDS users have a unique PDS ID to log in into their PDS, different from the credentials to logging into the system (FD6) -- you don't need to have a PDS to be able to log in into the edocs system"
59 ,A10,As business partners the delivery entities are trustworthy and therefore repudiation does not occur
59 ,A6,Tampering with dataflows inside the trust boundary does not happen (no external components)
59 ,A7,ID of dataflows within the trust boundary is not possible: nothing is external
59 ,A8,No ID on DF1-3 and DF6-10 because of encryption (ref A2)
59 ,A9,"Repudiation of processes and data stores can only happen from within and according to A1, this is not possible"
60 ,A10,Edocs uses a trustworthy mail provider
60 ,A11,"If a user opens a document, there is no point in it for them to deny they did"
60 ,A12,No logs are kept on the system
60 ,A13,There is no point for an attacker to tamper with the dataflow for registration
60 ,A14,User are authenticated by credentials
60 ,A6,Passwords are stored encrypted
60 ,A7,Communication between edocs and the print service/zoomit works with key pairs
60 ,A8,The data storage facilities are properly secured
60 ,A9,Mail provider always sends errors when it could not send mail
61 ,A6,DF4 and DF5 are not thoroughly secured (A2 does not cover this)
61 ,A7,"only external threats can occur, the internal system is very secure (extra confirmation for A1 and A3)"
61 ,A8,"PDFs and URL might contain sensitive, valuable and vulnerable information"
61 ,A9,The systems reputation is high enough to attract attackers (and wanting to cause harm)
62 ,A10,"The PDS keeps adequate logs about the users actions. Therefore, users can not deny having made some actions, such as reading a document"
62 ,A11,"DS1,DS2,DS3 are only accessible by P1, P2, P3. Thus, P1-3 cant be spoofed to the datastores, e.g. P3 runs on the same physical node as DS2 and DS3, so they are not coneected over Internet. Tampering & ID are therefore impossible"
62 ,A12,"All encrypted communication can be read by the receiver only, an assymetric encryption scheme is used"
62 ,A13,"All datastores keep logs of every action that is undertaken. Once logged, an  entry in the log is immutable"
62 ,A7,"E1,E2,E3 can not be spoofed. Due to the assumption A2, an attacker can not send meaningful messages to the system in their name, nor can he interpret messages obtained by name squatting"
62 ,A8,"E1,E2 and E3 will deny neither the reception of a document for delivery nor the delivery of a document, since this would cost them money (assumption: they are paid per document that is delivered)"
62 ,A9,"Due to the encryption of dataflows between E1 E2 and E3 and P2, P2 is immune to tampering by passing malicious parameters. Attackers can not construct messages to P2 since they do not have the encryption key (in contrast to the communication between E4 and P3)"
63 ,A6,The data flow between P2 and E3 are not encrypted
63 ,A7,"P1, P2, P3 can each be deployed on a different node"
63 ,A8,DS1 and DS2 are replicated on multiple nodes
63 ,A9,"The PDS and PDS user data (DS3) are on the same node and their data flows are encrypted (DF21,22,23)"
64 ,A11,eDocs admins are only allowed to log in in house
64 ,A12,PDS users are unable to request any information of other users
64 ,A13,"The delivery manager and scheduler and the PDS and the PDS process only communicate through local network, preventing internal data flow attacks"
64 ,A15,External delivery services can not request sending a specific document
64 ,A6,We use well-established printing service companies and send docs automatically. There there is no risk of spoofing and repudiation
64 ,A7,"Zoomit is wellknown service and all communication is automated. We assume, since zoomit handles bank info, that zoomit is protected against attackers getting access to docs"
64 ,A8,"Our emails are sent inhouse and therefore the email provider is not vulnerable to spoofing (DF4-5,E3)"
64 ,A9,PDS users are authenticated by means of credentials
65 ,A10,"All input is verified, queries in databases use precautions to counter against SQL injections"
65 ,A11,The system provides interfaces/facades that limit access to it. All communication goes through them
65 ,A6,A PDS user can only read documents from the PDS docs (DS2) so it cannot be tampered
65 ,A7,"Whenever PDS user registers, the mail address is verified so that only the actual owner of the email address can use it and obtain all docs linked to it"
65 ,A8,"The print service and zoomit are properly authenticated. data that is sent, is signed so the sender can be verified"
65 ,A9,The delivery scheduler and generated docs archive can only be accessed by internal processes
66 ,A10,Each generated document is delivered at least once
66 ,A11,The delivery manager will only retrieve documents from DS1 when told to by the scheduler
66 ,A12,The delivery manager will only deliver messages when told to by the scheduler
66 ,A13,When a user registers he receives a randomly generated password that can be changed if wanted
66 ,A14,Altering a document has no effect on the actual payment depending on the document
66 ,A15,Zoomit and emailprovider can not request documents
66 ,A16,"The generated docs archive will never alter documents nor ids, only status info"
66 ,A17,Status info updates can only follow this order: (to prevent resending and hiding docs): received data->generating->generated->sent->delivered->read
66 ,A18,The delivery manager keeps no information of a customer organisation or client
66 ,A19,It's not possible for a PDS user to delete a doc
66 ,A20,It's not pssoble to tamper with internal connections or components without access from an outside component (e.g. DF14 cannot be listened in on)
66 ,A6,PDS user is authenticated by means of credentials
66 ,A7,It's not possible to spoof someone's real life address (eg steal his postal mail)
66 ,A8,Resending a document never implies it is billed multiple times
66 ,A9,It's not posible to alter a PDF
67 ,A10,The sensitive information in PDS user data (DS3) is hashed in order to keep it secure
67 ,A6,"The print service, zoomit and the email provider have no gain to repudiate. Therefore, we can assume the repudiation threat can be ignored for them."
67 ,A7,All external entities (E1-E4) are authenticated by means of credentials. The implementation of the authentication is secure
67 ,A7,All external entities (E1-E4) are authenticated by means of credentials. The implementation of the authentication is secure
67 ,A8,"The print service, zoomit and the email provider are expected to be trustworthy. So they are expected to be able to keep their credentials secret."
67 ,A9,Each of the invoices is signed with a key and cannot be tampered with without removing the signature
68 ,A10,There is no identification by IP address to the send services.
68 ,A11,There is no limit to the amount of shipments on the send services
68 ,A12,A document with tracking for an unregistred user has a public link
68 ,A6,All customer organization employees can be trusted on the fact that they dont send illegal/spam mailing
68 ,A7,The E-mail provider is a secure environment. Only authenticationusers have access to send data
68 ,A9,A document can be accessed unlimited times
69 ,A10,PDS docs and PDS user data contain no logs
69 ,A6,Every entity is identified with credentials
69 ,A7,The PDS can be accessed by internet
69 ,A8,Edocs has an SLA with every delivery service
69 ,A9,There is not worthwhile action a PDS user wants to repudiate
70 ,A10,"its not possible to information disclosure from DF1,2,3,6,7,8,9,10 because of A2"
70 ,A11,Its not possible to disclose information from P1 because it's not connected to an external entity
70 ,A12,Its not possible to tamper or disclose information from the DFs 11-13 because it's traffic between P1 and DS1
70 ,A13,The printer service cannot be spoofed because no incoming request/dataflow is sent by this service\
70 ,A6,the PDS user logs in by means of credentials
70 ,A7,"Data flows 1,2,3,6,7,8,9,10 are not considered as a ""tamperng threat"" because of A2"
70 ,A8,"It's not possible to spoof P1 because it only receives requests via DS1, not from external entitiy"
70 ,A9,Its not possible to tamper a process because of A3
71 ,A10,"For zoomit delivery, a credit card number is provided"
71 ,A11,A credit card number is saved in the PDS user data
71 ,A6,the PDS user logs in by means of credentials
71 ,A7,Payslip/invoice does not contain very sensitive information
71 ,A8,There is no reason for attacker to read delivery notification (DF5)
71 ,A9,DF5 is only used to notify the system of delivery of a document or of the failure of a delivery
71 ,A9,DF5 is only used to notify system of doc delivery
72 ,A10,"Delivery manager only provides interface for acknowledging received, reporting errors (no queries)"
72 ,A11,There is no need for logging in for services in the delivery manager. All info is added by eDocs operators
72 ,A12,dataflows inside trust boundary are considered secure
72 ,A13,databases are secured against attacks (like SQL injections)
72 ,A6,"eDocs operators are trustworthy, so no untrustworthy privacy service, zoomit, or email provider can be added"
72 ,A9,Proper non-repudiation mechanism for users and services is provided so they cannot repudiate
73 ,A10,Data stores are type checked and do not allow bad data
73 ,A11,Logs are encrypted and hash of logs is stored elsewhere
73 ,A6,the PDS user logs in by means of credentials
73 ,A7,Email provider has deal about security with our company
73 ,A8,dataflows between processes are encrypted and have confidentiality and integrity
73 ,A9,Access to data stores is authenticated and encrypted
74 ,A6,the PDS user logs in by means of credentials
74 ,A7,DF3 and DF5 can only be used for delivery notification
74 ,A8,DF4 and DF5 are not encrypted
74 ,A9,"eDocs has direct channel to print service, zoomit and email provider and no entity can pose as one of them"
75 ,A10,"Through DF3, any registration/configuration with zoomit is setup as well"
75 ,A11,Zoomit is not prone to security leaks
75 ,A12,The Email provider is not prone to security leaks
75 ,A12,The Emailprovider is not prone to security leaks
75 ,A6,The PDS user is authenticated by means of credentials
75 ,A7,The PDS user makes use of an authentication UI
75 ,A8,The PDS user can reset credentials though email
75 ,A9,Any receipt tracking of documents is tracked server side and thus is reliable (and is logged)
76 ,A10,"Processes P1, P2, P3 write right logs and admin access"
76 ,A11,Login credentials are encrypted using MD5 encryption
76 ,A12,Documents are password protected
76 ,A13,The document archive (DS2) contains correctly generated documents
76 ,A6,The PDS users are authenticated by means of credentials
76 ,A7,The services like Zoomit and Email providers are authenticated by public key
76 ,A8,All flow between delivery manager and E-mail provider are not encrypted
76 ,A9,Logs are only stored in DS3
77 ,A10,"No data can be inserted in DS2, because that functionality is only internally available"
77 ,A6,All entities will explicitly acknowledge receival of a message
77 ,A7,"After individual authentication, individual requests are not checked for validity"
77 ,A8,SQL injection protection is not in place
77 ,A9,"Communication within the system can not be altered or leaked, cf also A1,A3"
78 ,A10,"All delivery channels (E1, E2, E3) are sufficiently protected against internal attacks"
78 ,A10,"All delivery channels (E1,E2,E3) are sufficiently protected against internal attacks"
78 ,A11,E1 is a respected company and has nothing to win by repudiating document deliveries/receivals. It has a reputation to hold high
78 ,A12,Every sending component only discloses as much information as is necessary for the receiving component to do its job properly.
78 ,A13,A registered recipient needs to log in before accessing the document to which he/she has received a link in a notification mail
78 ,A7,E2 and E3 send a confirmaition to P2 upon receival
78 ,A8,E4 sends a confirmation to P3 upon receival
78 ,A9,DF12 only contains the necessary info for P1 to function properly. This information is not distributed any further along the channel if it is not necessary
79 ,A6,"The communication between delivery scheduler , P1 and generated docs archive DS1 is considered to (be) secured since it are internal communcation flows of the system. Thus the dataflows: P1->DS1 and DS1-> P1 are considered to be safew"
79 ,A7,"The flows P1->P2, P2->DS1, P2->P3, P2->P3 are considered secure since it are internal comminication flows of edocs entities"
79 ,A8,"The flows P3->P2, P3->P2, P3->DS2,DS2->P3 are considered secure since it are internal comminication flows of edocs entities"
79 ,A9,"The flows P3->DS2,P3->DS2,DS3->P3 are considered secure since it are internal comminication flows of edocs entities"
80 ,A6,Passwords cant be changed by other people than the user
80 ,A7,The PDS is sufficiently secure (so) that gaining full access is impossible without the right credentials
80 ,A8,Print and .. logs are correct and secure/Delivery schedler and manager are secure in  way that the system can be sure of what was sent
81 ,A10,It has no use to spoof P1 and P2 because they can get access to important information.The only mehtods that they can do is send a document and accept delivery of a document
81 ,A11,The contact information is given in the meta data of the document. The A2 says that it wont be changed. Therefore the documents will be delivered at the right address
81 ,A12,"Because everyone needs to log in before something can be added/changed to the system, no one can without permission change something in the system."
81 ,A13,A mail is sent to the mail address which is given when creating an account. The mail eneds to be received and accepted before the account is activated
81 ,A14,"Before something can be retrieved, someone needs to log in and have the permission to retrieve it"
81 ,A6,"Print service, zoomit and mail provider are secure enough so that they cant be spoofed (they use secure keys)"
81 ,A7,PDS users log in using credentials
81 ,A9,"WHen a document is retrieved from the PDS, this retrieval is documented and saved. The system cant use repudiation (sic)"
82 ,A10,"Good access control in DS1-3; so no info is leaked and tampered requests are ignored. Tampered request= user asks for doc1, tampered req asks for doc 2(of another user)"
82 ,A11,PDS login happens through an email address and a password
82 ,A11,there are multiple instances of P2-P3 and can be spoofed. P1 and DS1-3 can not be spoofed
82 ,A12,Tampering with DF3 and DF5 is no problem. It could be that documents would be resent but that is very unlikely and irrelevant
82 ,A13,DF14 seems irrelevant because P2 can only read from DS1 but no response is possible. Thus DF14 is ignored.
82 ,A14,DF11 and DF12 are completely trusted since P1 and DS1 connot be directly attacked
82 ,A6,DF4 and DF5 are encrypted and are considered to have channel confidentiality and integrity
82 ,A7,"Repudiation for E4 (and P3) is no threat. We dont care if he reads his own documents or not. Since no write are issued, this is OKay."
82 ,A8,The threats for P1 are irrelevant since the implementaiton is good and no attackers can reach it from outside. (See A1 and A3). It can not be reverse-engineered
82 ,A9,Credentials are hashed and salt is added so a spoofing PDS can not dump DS3
83 ,A10,The PDS can access all documents in PDS docs and all the user information
83 ,A11,The delivery scheduler and delivery manager are on the same machine. The PDS and the data stores are each on another machine
