Participant ID,Assumption ID,Summary
83 ,A6,PDS user can only view its own documents
83 ,A7,Only documents and their metadata are sent to the delivery channels (e.g. not the SLAs)
83 ,A8,Receiving a document twice doesnt mean you have to pay twice
83 ,A9,The delivery scheduler can only receive new documents that didn already pass through him
84 ,A10,spoofing the print service is no threat because there is no data flow from the print service back to the delivery manager
84 ,A6,The print service/zoomit/mail provider are trustworthy partners
84 ,A7,Zoomit and the mail provider have secure policy for storing credentials
84 ,A8,Data flows within the trust boundary cannot be attacked (DF11-DF23)
84 ,A9,DF4 and DF5 are not encrypted and thus have no channel confidentiality/integrity
85 ,A10,A proper framework is used while generating the documents. Hence the threat level is very negligible
85 ,A11,A cross check is done after every implementation so that memory level manipulation is ensured (SIC)
85 ,A12,The generated docs archive maintains integrity
85 ,A13,The delivery manager will make sure that the delivery channels are trustworthy
85 ,A14,"The data flows between PDS (P3) and E4 (PDS user) is encrypted (DF6,DF7,DF9, DF10) so that tampering of data can be reduced"
85 ,A15,The data stored in PDS are restricted with permission credentials where  only trusted people can access at
85 ,A16,All the dataflows within turst boundary are all encrypted
85 ,A17,"The development, testing, maintenance, implementating, everything is secured."
85 ,A18,While giving login credentials to users or while users setting the login credentials should allow all instruction given so that the chances of threats are less
85 ,A19,Every entity should maintain the crosscheck in each and every step
85 ,A20,Entities should maintain integrity
85 ,A21,Confidential information should not be stored with someone who is not authorized
85 ,A22,Professional ethics should be maintained by every one and should misutilize properties as personal
85 ,A6,The generated documents are well-maintained so as to ensure security
85 ,A7,The stored documents in generated docs archive are given with strong permission credentials so that authorized users can assess
85 ,A8,The data flow between P2 and E3 are encrypted and integrity is maintained in a well amnner
85 ,A9,The edocs system is divided into small parts so that it is easy to maintain the security of each and every stem (?) systems
86 ,A10,The PDS uses sessions for logged-in users
86 ,A11,Sending Emails via the E-mail provider is secure
86 ,A6,The PDS user is authenticated with credentials
86 ,A7,"The print service, zoomit and mail providers are trustworthy and will not disclose documents"
86 ,A8,"They (The print service, zoomit and mail providers) will never deny being sent a document"
86 ,A9,All communication within the trust boundary is safe
87 ,A6,The employees are trained in password managment. Therefore they all have an unguessable strong password which is secretly stored in their mind
87 ,A7,Edocs database are only accessible from within the system
87 ,A8,"When a user account is made, the email address hsould be confirmed"
88 ,A7,A PDS user is authenticated by means of credentials
88 ,A8,"All the datastores are protected (DS1,DS2, DS3)"
88 ,A9,The PDS (P3) only contains documents of a specific user
89 ,A10,EDocs pays the mail provider per mail they send
89 ,A12,"Seen A1 and A2, the data from and to the PDS user is not vulnerable for information disclosure"
89 ,A13,DF5 is not vulnerable to information disclosure; it does not contain info useful to an outsider
89 ,A14,PDS users can remove documents from their overview
89 ,A15,"Attacker could mail E1,E2, E4 with an email that ressembles edocs email saying it has lost its credentials. We assume that E1,E2,E3 are good enough programmed to no send credentials to a resembling address"
89 ,A17,"If a user forgets his password to the PDS, his password is emailed to him"
89 ,A18,The deliverers have no way of distinguishing messages that are already sent and new messages
89 ,A6,"Edocs logins by credentials to zoomit,email provider, print service, and sends them their documents to be sent"
89 ,A7,"The print service, zoomit, email provider only send documents. We assume that they want to have high profits so they wont say that they havent sent a document and miss a billing opportunity"
89 ,A8,A PDS user is authenticated by means of credentials
89 ,A9,DF4 and DF5 do not have any encryption
90 ,A10,We assume there are no logs held for the PDS user interaction with the PDS
90 ,A11,We assume that either DF9 or DF10 is responsible for receipt notification
90 ,A12,"We assume for DF12, DF13, DF15,DF19 and DF20 that the document itself is sent, not a document id that is later used for document retrieval"
90 ,A13,"We assume for DF12, DF13, DF15,DF19 and DF20 that the document is not used for "
90 ,A14,"We assume only requests are sent in DF11, no documents"
90 ,A15,"For dataflow DF14, we assume only limited request can be made (status) so impact and likelihood are very low"
90 ,A16,"We assume for DF16, only minor data can be sent"
90 ,A17,"We assume tthat the DS2, DS3 and P3 are thightly coupled so the likelihood of breaking in the DB is almost zero"
90 ,A18,"We assume the internal working of P1,P2, and P3 are complex enough they cant be spoofed without recognition"
90 ,A6,The PDS user has received credentials at registration and uses them for authentication
90 ,A7,"For E1,E2,E3 we assume there is a good SLA and consider them services that are trustworthy"
90 ,A8,We assume that for DF4 and DF5 that the communicaion occurs with a simple SMTP servier that is not secure and easily hacked
90 ,A9,"We assume that for DF5, the email provider only sends deliverer notifications and receipt tracking info"
91 ,A10,The print service has taken security measures to prevent the takeover of its system
91 ,A11,Spoofing an email provider only results in being able to park documents as sent. This is no useful functionality for an attacker
91 ,A12,A PDS user is authenticated by means of credentials
91 ,A13,The delivery scheduler is not connected durectly to systems outside of eDocs 
91 ,A14,"The generated documents are valid info for the delivery scheduler, no input validation is necessary (P1)"
91 ,A15,The delivery scheduler does not deny having sent or received documents
91 ,A16,The delivery scheduler can only communicate with parts of the eDocs system. No design-level information disclosure is possible
91 ,A17,"No tampering is possible with DF1 when using strong encryption (also for DF2, and DF3)"
91 ,A18,Communication goes over the public Internet
91 ,A19,Email traffic is not encrypted
91 ,A20,Email traffic is sent over the public internet
91 ,A6,"The spoofing of a print service (E1) is not applicable, since the system knows the correct delivery on only sends info to it"
91 ,A7,The print service has seigned a legally binding SLA specifiying it will print and send documents
91 ,A8,Zoomit has signed a legally binding SLA specifying it will deliver the documents it receives
91 ,A9,Zoomit has taken security measures to prevent the takeover of its system
92 ,A6,"DS3 passwords are not stored in plain text, with hash and salt -> even when attackers get access no immediate harm is done"
92 ,A7,"When entities deny they received the data that was sent to them, it is sent again"
92 ,A8,Data sent between PDS and PDS User data is encrypted so that this very sensitive information cannot be read in data flow
94 ,A7,Queries to the PDS datastore are not authenticated
